,a,grammatical,b
295,Jessica found John a criminal.,0,Jessica found a criminal to John.
296,Jessica found Kelly the best.,0,Jessica found the best to Kelly.
297,Christopher found David the most valuable player.,0,Christopher found the most valuable player to David.
298,Jessica proclaimed John a hero.,0,Jessica proclaimed a hero to John.
299,Nicole proclaimed Kelly a loser.,0,Nicole proclaimed a loser to Kelly.
300,Jessica proclaimed Rebecca the greatest athlete.,0,Jessica proclaimed the greatest athlete to Rebecca.
301,Jessica proclaimed John a criminal.,0,Jessica proclaimed a criminal to John.
302,Michael proclaimed Rebecca the best.,0,Michael proclaimed the best to Rebecca.
303,Christopher proclaimed John the most valuable player.,0,Christopher proclaimed the most valuable player to John.
304,Christopher thought John a hero.,0,Christopher thought a hero to John.
305,Michael thought David a loser.,0,Michael thought a loser to David.
306,Michael thought Susan the greatest athlete.,0,Michael thought the greatest athlete to Susan.
307,Jessica thought Kelly a criminal.,0,Jessica thought a criminal to Kelly.
308,Nicole thought Rebecca the best.,0,Nicole thought the best to Rebecca.
309,Michael thought Susan the most valuable player.,0,Michael thought the most valuable player to Susan.
310,Jessica labeled Rebecca a hero.,0,Jessica labeled a hero to Rebecca.
311,Jason labeled John a loser.,0,Jason labeled a loser to John.
312,Jason labeled David the greatest athlete.,0,Jason labeled the greatest athlete to David.
313,Nicole labeled David a criminal.,0,Nicole labeled a criminal to David.
314,Michael labeled Susan the best.,0,Michael labeled the best to Susan.
315,Christopher labeled David the most valuable player.,0,Christopher labeled the most valuable player to David.
316,Nicole ruled John a hero.,0,Nicole ruled a hero to John.
317,Jessica ruled James a loser.,0,Jessica ruled a loser to James.
318,Jessica ruled David the greatest athlete.,0,Jessica ruled the greatest athlete to David.
319,Jessica ruled John a criminal.,0,Jessica ruled a criminal to John.
320,Jessica ruled Rebecca the best.,0,Jessica ruled the best to Rebecca.
321,Michael ruled David the most valuable player.,0,Michael ruled the most valuable player to David.
